{"branches":[{"branch_id":"reversible_identity","capacity_formula":"M0=24*k","channel_rule":"output=(port,copy)","claimed_bounded_zero_set":[{"k":1,"spectator_multiplicity":1},{"k":2,"spectator_multiplicity":1},{"k":3,"spectator_multiplicity":1},{"k":4,"spectator_multiplicity":1}],"sample_rows":[{"claimed_capacity_M0":24,"claimed_slack_zero":true,"k":1,"public_dimension":24,"raw_dimension":24,"spectator_multiplicity":1},{"claimed_capacity_M0":48,"claimed_slack_zero":true,"k":2,"public_dimension":48,"raw_dimension":48,"spectator_multiplicity":1},{"claimed_capacity_M0":72,"claimed_slack_zero":true,"k":3,"public_dimension":72,"raw_dimension":72,"spectator_multiplicity":1},{"claimed_capacity_M0":96,"claimed_slack_zero":true,"k":4,"public_dimension":96,"raw_dimension":96,"spectator_multiplicity":1}],"shared_source_signature_sha256":"sha256:7fe69351e834a0938811e0bb574fafdfa75a869e237f0e4f1d5b68173fb64b7d","upstream_pins":{"fixed_packet_projection_sha256":"sha256:ebcb39b77655c34a165f0c59c16816a15c7279e546910d0094b9e4ca36d2c34f","fixed_packet_verifier_contract_sha256":"sha256:42d5f753ca570adcb9b0c21019f15366ee557d5e15db25365befc9c6a818df2c"}},{"branch_id":"copy_collapse_erasure","capacity_formula":"M0=24","channel_rule":"output=port","claimed_bounded_zero_set":[{"k":1,"spectator_multiplicity":1}],"sample_rows":[{"claimed_capacity_M0":24,"claimed_slack_zero":true,"k":1,"public_dimension":24,"raw_dimension":24,"spectator_multiplicity":1},{"claimed_capacity_M0":24,"claimed_slack_zero":false,"k":2,"public_dimension":48,"raw_dimension":48,"spectator_multiplicity":1},{"claimed_capacity_M0":24,"claimed_slack_zero":false,"k":3,"public_dimension":72,"raw_dimension":72,"spectator_multiplicity":1},{"claimed_capacity_M0":24,"claimed_slack_zero":false,"k":4,"public_dimension":96,"raw_dimension":96,"spectator_multiplicity":1}],"shared_source_signature_sha256":"sha256:7fe69351e834a0938811e0bb574fafdfa75a869e237f0e4f1d5b68173fb64b7d","upstream_pins":{"fixed_packet_projection_sha256":"sha256:ebcb39b77655c34a165f0c59c16816a15c7279e546910d0094b9e4ca36d2c34f","fixed_packet_verifier_contract_sha256":"sha256:42d5f753ca570adcb9b0c21019f15366ee557d5e15db25365befc9c6a818df2c"}},{"branch_id":"capped_two_class","capacity_formula":"M0=24*min(k,2)","channel_rule":"output=(port,min(copy,1))","claimed_bounded_zero_set":[{"k":1,"spectator_multiplicity":1},{"k":2,"spectator_multiplicity":1}],"sample_rows":[{"claimed_capacity_M0":24,"claimed_slack_zero":true,"k":1,"public_dimension":24,"raw_dimension":24,"spectator_multiplicity":1},{"claimed_capacity_M0":48,"claimed_slack_zero":true,"k":2,"public_dimension":48,"raw_dimension":48,"spectator_multiplicity":1},{"claimed_capacity_M0":48,"claimed_slack_zero":false,"k":3,"public_dimension":72,"raw_dimension":72,"spectator_multiplicity":1},{"claimed_capacity_M0":48,"claimed_slack_zero":false,"k":4,"public_dimension":96,"raw_dimension":96,"spectator_multiplicity":1}],"shared_source_signature_sha256":"sha256:7fe69351e834a0938811e0bb574fafdfa75a869e237f0e4f1d5b68173fb64b7d","upstream_pins":{"fixed_packet_projection_sha256":"sha256:ebcb39b77655c34a165f0c59c16816a15c7279e546910d0094b9e4ca36d2c34f","fixed_packet_verifier_contract_sha256":"sha256:42d5f753ca570adcb9b0c21019f15366ee557d5e15db25365befc9c6a818df2c"}},{"branch_id":"hidden_spectator","capacity_formula":"raw_D=24*k*s;M0=24*k","channel_rule":"output=(port,copy);spectator-hidden","claimed_bounded_zero_set":[{"k":1,"spectator_multiplicity":1},{"k":2,"spectator_multiplicity":1},{"k":3,"spectator_multiplicity":1},{"k":4,"spectator_multiplicity":1}],"sample_rows":[{"claimed_capacity_M0":24,"claimed_slack_zero":true,"k":1,"public_dimension":24,"raw_dimension":24,"spectator_multiplicity":1},{"claimed_capacity_M0":24,"claimed_slack_zero":false,"k":1,"public_dimension":24,"raw_dimension":48,"spectator_multiplicity":2},{"claimed_capacity_M0":24,"claimed_slack_zero":false,"k":1,"public_dimension":24,"raw_dimension":72,"spectator_multiplicity":3},{"claimed_capacity_M0":48,"claimed_slack_zero":true,"k":2,"public_dimension":48,"raw_dimension":48,"spectator_multiplicity":1},{"claimed_capacity_M0":48,"claimed_slack_zero":false,"k":2,"public_dimension":48,"raw_dimension":96,"spectator_multiplicity":2},{"claimed_capacity_M0":48,"claimed_slack_zero":false,"k":2,"public_dimension":48,"raw_dimension":144,"spectator_multiplicity":3},{"claimed_capacity_M0":72,"claimed_slack_zero":true,"k":3,"public_dimension":72,"raw_dimension":72,"spectator_multiplicity":1},{"claimed_capacity_M0":72,"claimed_slack_zero":false,"k":3,"public_dimension":72,"raw_dimension":144,"spectator_multiplicity":2},{"claimed_capacity_M0":72,"claimed_slack_zero":false,"k":3,"public_dimension":72,"raw_dimension":216,"spectator_multiplicity":3},{"claimed_capacity_M0":96,"claimed_slack_zero":true,"k":4,"public_dimension":96,"raw_dimension":96,"spectator_multiplicity":1},{"claimed_capacity_M0":96,"claimed_slack_zero":false,"k":4,"public_dimension":96,"raw_dimension":192,"spectator_multiplicity":2},{"claimed_capacity_M0":96,"claimed_slack_zero":false,"k":4,"public_dimension":96,"raw_dimension":288,"spectator_multiplicity":3}],"shared_source_signature_sha256":"sha256:7fe69351e834a0938811e0bb574fafdfa75a869e237f0e4f1d5b68173fb64b7d","upstream_pins":{"fixed_packet_projection_sha256":"sha256:ebcb39b77655c34a165f0c59c16816a15c7279e546910d0094b9e4ca36d2c34f","fixed_packet_verifier_contract_sha256":"sha256:42d5f753ca570adcb9b0c21019f15366ee557d5e15db25365befc9c6a818df2c"}}],"physical_n_closure_promoted":false,"schema":"oph.capacity_indexed_source_family_projection.v1","scientific_verdict":"SOURCE_CLASS_NONIDENTIFIABLE","shared_source":{"base_public_atoms":24,"branch_completion_scope":"alternative-continuations-of-one-declared-finite-source-antecedent","pin_scope":"semantic-contract-identifiers-not-file-custody","rung_parameter":"positive-integer-k","sample_rungs":[1,2,3,4],"source_rule_id":"oph.public-record-capacity.branch-completion-family.v1","spectator_multiplicities":[1,2,3]},"shared_source_signature_sha256":"sha256:7fe69351e834a0938811e0bb574fafdfa75a869e237f0e4f1d5b68173fb64b7d","target_cleanliness":{"desired_capacity_read":false,"electroweak_target_read":false,"external_fit_read":false,"measured_cosmological_constant_read":false,"observed_horizon_radius_read":false},"upstream_pins":{"fixed_packet_projection_sha256":"sha256:ebcb39b77655c34a165f0c59c16816a15c7279e546910d0094b9e4ca36d2c34f","fixed_packet_verifier_contract_sha256":"sha256:42d5f753ca570adcb9b0c21019f15366ee557d5e15db25365befc9c6a818df2c"}}
